{"schema_version":"1.0","generated_at":"2026-10-27T03:45:00Z","date":"2026-10-27","edition":"morning","timezone":"Asia/Riyadh","next_build_at":"2026-10-27T16:00:00Z","sections":[{"id":"trending_repos","title":"Trending repos","items":[{"id":"debpalash-voicestudio","section":"trending_repos","status":"updated","title":"debpalash/VoiceStudio - 2,297 stars today, still the page's top repo","summary":"voicestudio does voice cloning, dubbing, dictation and audiobooks locally in 646 languages, with no api key and no cloud round-trip.\n2,297 stars in 24 hours took it to 89,536, and the repo was still being pushed to this morning.","sources":[{"name":"GitHub","url":"https://github.com/debpalash/VoiceStudio"},{"name":"GitHub Trending","url":"https://github.com/trending?since=daily"}],"published_at":"2026-10-27T03:30:00Z","meta":{"stars_today":2297,"stars_total":89536,"language":"python","license":"AGPL-3.0"},"tags":["voice","local-ai"],"updated":true},{"id":"nutlope-hallmark","section":"trending_repos","status":"steady","title":"Nutlope/hallmark - 2,244 stars for an anti-slop design skill","summary":"hallmark hands claude code, cursor and codex concrete css rules so pages stop looking like default ai output.\n2,244 stars today held second place on 36,702 total, a big following for a repo that is mostly a skill file.","sources":[{"name":"GitHub","url":"https://github.com/Nutlope/hallmark"},{"name":"Trendshift","url":"https://trendshift.io/"}],"published_at":"2026-10-27T03:30:00Z","meta":{"stars_today":2244,"stars_total":36702,"language":"css","license":"MIT"},"tags":["design","skills"],"updated":false},{"id":"pbakaus-impeccable","section":"trending_repos","status":"updated","title":"pbakaus/impeccable - 1,506 stars for a design language agents can load","summary":"impeccable packages a shared design vocabulary an agent reads instead of guessing at taste.\nit slipped from 1,551 stars yesterday to 1,506 today and sits on 89,355 total, with the repo pushed again at 03:11 utc.","sources":[{"name":"GitHub","url":"https://github.com/pbakaus/impeccable"},{"name":"GitHub Trending","url":"https://github.com/trending?since=daily"}],"published_at":"2026-10-27T03:30:00Z","meta":{"stars_today":1506,"stars_total":89355,"language":"rust","license":"Apache-2.0"},"tags":["design","skills"],"updated":true},{"id":"tauric-tradingagents","section":"trending_repos","status":"updated","title":"TauricResearch/TradingAgents - 1,395 stars for a multi-agent trading desk","summary":"tradingagents puts a research desk of llm agents around a trade, with bull and bear analysts arguing before anything is bought.\n1,395 stars today took it to 116,322, the biggest finance repo on the page and one built for people who already trade.","sources":[{"name":"GitHub","url":"https://github.com/TauricResearch/TradingAgents"},{"name":"Trendshift","url":"https://trendshift.io/"}],"published_at":"2026-10-27T03:30:00Z","meta":{"stars_today":1395,"stars_total":116322,"language":"python","license":"Apache-2.0"},"tags":["trading","agents"],"updated":true},{"id":"makecindy-cindy","section":"trending_repos","status":"updated","title":"makecindy/cindy - 1,296 stars for an agent that claims to work out of the box","summary":"cindy is pitched at people who do not want to spend an evening wiring tools into an agent first.\n1,296 stars today took it to 6,670, so nearly all of its audience has found it in the last few days.","sources":[{"name":"GitHub","url":"https://github.com/makecindy/cindy"},{"name":"GitHub Trending","url":"https://github.com/trending?since=daily"}],"published_at":"2026-10-27T03:30:00Z","meta":{"stars_today":1296,"stars_total":6670,"language":"typescript","license":"Apache-2.0"},"tags":["agents"],"updated":true},{"id":"jetbrains-thinkrail","section":"trending_repos","status":"updated","title":"JetBrains/thinkrail - 1,173 stars as a big vendor ships an agentic ide","summary":"thinkrail is an open-source, lightweight ide that customises itself around how you work and runs an agent inside the editor.\n1,173 stars today took it to 3,078, with 224 open issues showing how fast it is being built.","sources":[{"name":"GitHub","url":"https://github.com/JetBrains/thinkrail"},{"name":"Trendshift","url":"https://trendshift.io/"}],"published_at":"2026-10-27T03:30:00Z","meta":{"stars_today":1173,"stars_total":3078,"language":"typescript","license":"Apache-2.0"},"tags":["ide","agents"],"updated":true},{"id":"affaan-m-ecc","section":"trending_repos","status":"updated","title":"affaan-m/ECC - 896 stars for an agent-harness tuning layer","summary":"ECC bundles skills, instinct files, memory, security checks and research habits into one optimisation layer for claude code, codex, opencode and cursor.\n896 stars today on 289,960 total, the largest star base on the page and the one that has been around longest.","sources":[{"name":"GitHub","url":"https://github.com/affaan-m/ECC"},{"name":"GitHub Trending","url":"https://github.com/trending?since=daily"}],"published_at":"2026-10-27T03:30:00Z","meta":{"stars_today":896,"stars_total":289960,"language":"javascript","license":"MIT"},"tags":["agents","harness"],"updated":true},{"id":"pollen-robotics-microduck","section":"trending_repos","status":"steady","title":"pollen-robotics/microduck - the biped duck keeps its place","summary":"microduck is a desk-sized two-legged robot duck, and the repo carries the control code that makes it walk. it is written in rust.\n843 stars today and 12,488 total, holding a spot on the page for a second day.","sources":[{"name":"GitHub","url":"https://github.com/pollen-robotics/microduck"},{"name":"GitHub Trending","url":"https://github.com/trending?since=daily"}],"published_at":"2026-10-27T03:30:00Z","meta":{"stars_today":843,"stars_total":12488,"language":"rust","license":"Apache-2.0"},"tags":["robotics"],"updated":false}],"watch":[{"title":"Meet Microduck, the $399 Tiny Robot You Can Teach New Tricks","url":"https://www.youtube.com/watch?v=reiTh7K4KSc","channel":"Pollen Robotics"},{"title":"JetBrains Just Released an Open-Source Agentic IDE (ThinkRail)","url":"https://www.youtube.com/watch?v=yF5EGEKA_B4","channel":"NeuralNine"},{"title":"Free, Open-Source ElevenLabs Alternative? Clone Your Voice with VoiceStudio","url":"https://www.youtube.com/watch?v=59tiqK0EFs0","channel":"Jeffery"}]},{"id":"middle_east","title":"Middle East","items":[{"id":"jordan-strikes-syria","section":"middle_east","status":"new","title":"jordan bombs targets in syria and damascus shuts the border","summary":"jordanian jets hit what the army called militant hideouts in daraa and suweyda overnight, retaliation for friday's church attack in karak that killed nine.\nsyria says at least seven people died, including three children, that it was not told in advance, and it has closed the nasib crossing.","change":"jordan's first strikes inside syria since the attack, and the only passenger crossing between the two countries is now shut.","sources":[{"name":"BBC News","url":"https://www.bbc.co.uk/news/articles/cq8ezg6dy6xlo"},{"name":"Al Jazeera","url":"https://www.aljazeera.com/news/2026/10/26/jordan-launches-air-strikes-in-syria-in-response-to-a-fatal-church-shooting"},{"name":"The Guardian","url":"https://www.theguardian.com/world/2026/oct/26/jordan-attacks-militants-syria-retaliation-for-last-week-church-attack"}],"published_at":"2026-10-27T02:40:00Z","meta":{"region":"jordan-syria","deaths_reported":7},"tags":["jordan","syria"],"updated":true},{"id":"israel-election-poll","section":"middle_east","status":"updated","title":"israelis vote today in an election the polls call a coin flip","summary":"voting is under way with likud and eisenkot's yashar level in the final surveys, and about 70,000 israelis flew home to cast a ballot.\nnetanyahu closed with an ai image of a nuclear strike on tel aviv and trump's endorsement, while west bank crossings are shut for the day.","change":"it is voting day: the campaign is over, the crossings are closed and the count starts tonight.","sources":[{"name":"BBC News","url":"https://www.bbc.co.uk/news/articles/crlykey9jywqo"},{"name":"The Jerusalem Post","url":"https://www.jpost.com/israel-news/politics-and-diplomacy/article-912978"},{"name":"The Guardian","url":"https://www.theguardian.com/world/2026/oct/26/what-you-need-to-know-about-the-most-consequential-election-in-israels-history"}],"published_at":"2026-10-27T03:12:00Z","meta":{"region":"israel","election":"2026-10-27"},"tags":["israel","election"],"updated":true},{"id":"netanyahu-zamir-iran","section":"middle_east","status":"new","title":"report: netanyahu pushed the idf to act on iran before the vote","summary":"channel 12 says netanyahu gave the military a directive on iran and that chief of staff eyal zamir asked to see it in writing.\nnetanyahu and the defence ministry deny any plan to strike, and the guardian reports his coalition is narrowly trailing.","change":"the story moved from a reported rift between the two men to a specific directive that zamir wanted in writing.","sources":[{"name":"The Guardian","url":"https://www.theguardian.com/world/2026/oct/26/netanyahu-reportedly-pressured-israel-military-attack-iran-runup-to-election"},{"name":"The Jerusalem Post","url":"https://www.jpost.com/israel-news/defense-news/article-912979"}],"published_at":"2026-10-26T19:21:00Z","meta":{"region":"israel-iran"},"tags":["israel","iran"],"updated":true},{"id":"saudi-tehran-talks","section":"middle_east","status":"updated","title":"the mecca pact delegation leaves tehran with a promise to keep talking","summary":"khalid bin salman, asim munir and ibrahim kalin met pezeshkian and rezaei, and both sides said they would keep talking about regional security.\niran says washington is not serious, and oman's foreign minister used the same day to propose a gulf-iran security pact with no us at its centre.","change":"the visit ended with an agreement to keep talking rather than a deal, and oman publicly broke ranks on the us role.","sources":[{"name":"Th